{
  "$schema": "https://json-schema.org/draft/2020-12/schema",
  "type": "object",
  "properties": {
    "version": {
      "type": "number",
      "const": 1
    },
    "id": {
      "type": "string",
      "minLength": 1,
      "maxLength": 160
    },
    "name": {
      "type": "string",
      "minLength": 1,
      "maxLength": 100
    },
    "duration": {
      "type": "number",
      "exclusiveMinimum": 0
    },
    "fps": {
      "type": "integer",
      "minimum": 1,
      "maximum": 240
    },
    "origin": {
      "$ref": "#/$defs/__schema0"
    },
    "objects": {
      "type": "array",
      "items": {
        "type": "object",
        "properties": {
          "id": {
            "type": "string",
            "minLength": 1,
            "maxLength": 160
          },
          "name": {
            "type": "string",
            "minLength": 1,
            "maxLength": 100
          },
          "type": {
            "type": "string",
            "enum": [
              "Folder",
              "Model",
              "Part",
              "WedgePart",
              "MeshPart",
              "SpecialMesh",
              "Attachment",
              "ParticleEmitter",
              "Beam",
              "Trail",
              "PointLight",
              "SpotLight",
              "SurfaceLight",
              "Sound"
            ]
          },
          "parentId": {
            "type": "string",
            "minLength": 1,
            "maxLength": 160
          },
          "properties": {
            "default": {},
            "type": "object",
            "propertyNames": {
              "type": "string",
              "pattern": "^[A-Za-z][A-Za-z0-9]*$"
            },
            "additionalProperties": {
              "$ref": "#/$defs/__schema1"
            }
          },
          "preset": {
            "type": "string",
            "minLength": 1,
            "maxLength": 160
          },
          "effectType": {
            "type": "string"
          },
          "groupMembers": {
            "type": "array",
            "items": {
              "type": "string",
              "minLength": 1,
              "maxLength": 160
            }
          },
          "attributes": {
            "type": "object",
            "propertyNames": {
              "type": "string",
              "pattern": "^[A-Za-z][A-Za-z0-9]*$"
            },
            "additionalProperties": {
              "$ref": "#/$defs/__schema1"
            }
          },
          "tags": {
            "type": "array",
            "items": {
              "type": "string"
            }
          }
        },
        "required": [
          "id",
          "name",
          "type",
          "properties"
        ],
        "additionalProperties": false
      }
    },
    "timeline": {
      "type": "array",
      "items": {
        "type": "object",
        "properties": {
          "objectId": {
            "type": "string",
            "minLength": 1,
            "maxLength": 160
          },
          "frame": {
            "type": "integer",
            "minimum": 0,
            "maximum": 9007199254740991
          },
          "kind": {
            "default": "normal",
            "type": "string",
            "enum": [
              "normal",
              "emit",
              "effect",
              "event"
            ]
          },
          "properties": {
            "default": {},
            "type": "object",
            "propertyNames": {
              "type": "string",
              "pattern": "^[A-Za-z][A-Za-z0-9]*$"
            },
            "additionalProperties": {
              "$ref": "#/$defs/__schema1"
            }
          },
          "emit": {
            "type": "object",
            "propertyNames": {
              "type": "string"
            },
            "additionalProperties": {
              "$ref": "#/$defs/__schema2"
            }
          },
          "easingStyle": {
            "type": "string"
          },
          "easingDirection": {
            "type": "string",
            "enum": [
              "In",
              "Out",
              "InOut"
            ]
          },
          "easingCurve": {
            "$ref": "#/$defs/__schema3"
          }
        },
        "required": [
          "objectId",
          "frame",
          "kind",
          "properties"
        ],
        "additionalProperties": false
      }
    },
    "metadata": {
      "default": {},
      "type": "object",
      "propertyNames": {
        "type": "string"
      },
      "additionalProperties": {
        "$ref": "#/$defs/__schema4"
      }
    },
    "arcKeys": {
      "$ref": "#/$defs/__schema5"
    },
    "arcGroups": {
      "$ref": "#/$defs/__schema6"
    }
  },
  "required": [
    "version",
    "id",
    "name",
    "duration",
    "fps",
    "objects",
    "timeline",
    "metadata"
  ],
  "additionalProperties": false,
  "$defs": {
    "__schema0": {
      "anyOf": [
        {
          "type": "string"
        },
        {
          "type": "number"
        },
        {
          "type": "boolean"
        },
        {
          "type": "null"
        },
        {
          "type": "array",
          "items": {
            "$ref": "#/$defs/__schema0"
          }
        },
        {
          "type": "object",
          "propertyNames": {
            "type": "string"
          },
          "additionalProperties": {
            "$ref": "#/$defs/__schema0"
          }
        }
      ]
    },
    "__schema1": {
      "anyOf": [
        {
          "type": "string"
        },
        {
          "type": "number"
        },
        {
          "type": "boolean"
        },
        {
          "type": "null"
        },
        {
          "type": "array",
          "items": {
            "$ref": "#/$defs/__schema1"
          }
        },
        {
          "type": "object",
          "propertyNames": {
            "type": "string"
          },
          "additionalProperties": {
            "$ref": "#/$defs/__schema1"
          }
        }
      ]
    },
    "__schema2": {
      "anyOf": [
        {
          "type": "string"
        },
        {
          "type": "number"
        },
        {
          "type": "boolean"
        },
        {
          "type": "null"
        },
        {
          "type": "array",
          "items": {
            "$ref": "#/$defs/__schema2"
          }
        },
        {
          "type": "object",
          "propertyNames": {
            "type": "string"
          },
          "additionalProperties": {
            "$ref": "#/$defs/__schema2"
          }
        }
      ]
    },
    "__schema3": {
      "anyOf": [
        {
          "type": "string"
        },
        {
          "type": "number"
        },
        {
          "type": "boolean"
        },
        {
          "type": "null"
        },
        {
          "type": "array",
          "items": {
            "$ref": "#/$defs/__schema3"
          }
        },
        {
          "type": "object",
          "propertyNames": {
            "type": "string"
          },
          "additionalProperties": {
            "$ref": "#/$defs/__schema3"
          }
        }
      ]
    },
    "__schema4": {
      "anyOf": [
        {
          "type": "string"
        },
        {
          "type": "number"
        },
        {
          "type": "boolean"
        },
        {
          "type": "null"
        },
        {
          "type": "array",
          "items": {
            "$ref": "#/$defs/__schema4"
          }
        },
        {
          "type": "object",
          "propertyNames": {
            "type": "string"
          },
          "additionalProperties": {
            "$ref": "#/$defs/__schema4"
          }
        }
      ]
    },
    "__schema5": {
      "anyOf": [
        {
          "type": "string"
        },
        {
          "type": "number"
        },
        {
          "type": "boolean"
        },
        {
          "type": "null"
        },
        {
          "type": "array",
          "items": {
            "$ref": "#/$defs/__schema5"
          }
        },
        {
          "type": "object",
          "propertyNames": {
            "type": "string"
          },
          "additionalProperties": {
            "$ref": "#/$defs/__schema5"
          }
        }
      ]
    },
    "__schema6": {
      "anyOf": [
        {
          "type": "string"
        },
        {
          "type": "number"
        },
        {
          "type": "boolean"
        },
        {
          "type": "null"
        },
        {
          "type": "array",
          "items": {
            "$ref": "#/$defs/__schema6"
          }
        },
        {
          "type": "object",
          "propertyNames": {
            "type": "string"
          },
          "additionalProperties": {
            "$ref": "#/$defs/__schema6"
          }
        }
      ]
    }
  }
}